{"video":"synthetic_shots.mp4","fps":120,"width":1920,"height":1080,"schema_version":"1.0","frames":[{"f":0,"ball":[1148.6,916.1,39.0,0.85]},{"f":1,"ball":[1149.3,916.2,39.0,0.86]},{"f":2,"ball":[1149.2,914.7,39.0,0.82]},{"f":3,"ball":[1148.0,913.5,39.0,0.94]},{"f":4,"ball":[1149.2,917.3,39.0,0.87]},{"f":5,"ball":[1149.1,916.7,39.0,0.97]},{"f":6,"ball":[1150.8,918.7,39.0,0.81]},{"f":7,"ball":[1149.4,915.4,39.0,0.91]},{"f":8,"ball":[1150.2,916.1,39.0,0.88]},{"f":9,"ball":[1148.4,915.3,39.0,0.82]},{"f":10,"ball":[1151.2,915.1,39.0,0.82]},{"f":11,"ball":[1151.2,916.6,39.0,0.85]},{"f":12,"ball":[1150.9,918.5,39.0,0.87]},{"f":13,"ball":[1149.7,916.1,39.0,0.87]},{"f":14,"ball":[1151.5,916.5,39.0,0.94]},{"f":15,"ball":[1149.8,919.0,39.0,0.96]},{"f":16,"ball":[1150.3,916.9,39.0,0.89]},{"f":17,"ball":[1150.5,916.8,39.0,0.84]},{"f":18,"ball":[1147.9,914.7,39.0,0.9]},{"f":19,"ball":[1149.9,914.1,39.0,0.96]},{"f":20,"ball":[1149.1,917.4,39.0,0.96]},{"f":21,"ball":[1149.9,913.7,39.0,0.93]},{"f":22,"ball":[1150.4,915.5,39.0,0.88]},{"f":23,"ball":[1151.9,915.0,39.0,0.81]},{"f":24,"ball":[1148.4,914.5,39.0,0.9]},{"f":25,"ball":[1148.6,915.8,39.0,0.96]},{"f":26,"ball":[1149.2,912.7,39.0,0.96]},{"f":27,"ball":[1153.2,914.5,39.0,0.83]},{"f":28,"ball":[1150.4,914.9,39.0,0.91]},{"f":29,"ball":[1147.3,915.0,39.0,0.92]},{"f":30,"ball":[1149.5,915.3,39.0,0.94]},{"f":31,"ball":[1147.4,915.9,39.0,0.86]},{"f":32,"ball":[1148.1,916.5,39.0,0.86]},{"f":33,"ball":[1149.5,915.7,39.0,0.94]},{"f":34,"ball":[1150.7,916.6,39.0,0.85]},{"f":35,"ball":[1150.6,917.8,39.0,0.9]},{"f":36,"ball":[1150.1,913.5,39.0,0.85]},{"f":37,"ball":[1149.5,918.0,39.0,0.92]},{"f":38,"ball":[1151.2,916.6,39.0,0.9]},{"f":39,"ball":[1151.0,916.7,39.0,0.84]},{"f":40,"ball":[1149.2,918.3,39.0,0.82]},{"f":41,"ball":[1151.7,918.4,39.0,0.86]},{"f":42,"ball":[1149.8,915.8,39.0,0.97]},{"f":43,"ball":[1151.9,917.6,39.0,0.9]},{"f":44,"ball":[1149.1,915.7,39.0,0.92]},{"f":45,"ball":[1149.9,916.0,39.0,0.91]},{"f":46,"ball":[1148.4,915.4,39.0,0.91]},{"f":47,"ball":[1151.3,916.5,39.0,0.88]},{"f":48,"ball":[1150.7,918.2,39.0,0.91]},{"f":49,"ball":[1152.7,917.4,39.0,0.8]},{"f":50,"ball":[1150.4,916.7,39.0,0.85]},{"f":51,"ball":[1149.9,917.2,39.0,0.9]},{"f":52,"ball":[1152.1,916.3,39.0,0.89]},{"f":53,"ball":[1148.4,917.4,39.0,0.89]},{"f":54,"ball":[1149.8,917.2,39.0,0.88]},{"f":55,"ball":[1149.6,915.9,39.0,0.9]},{"f":56,"ball":[1151.0,914.8,39.0,0.81]},{"f":57,"ball":[1149.7,916.1,39.0,0.87]},{"f":58,"ball":[1149.9,915.0,39.0,0.96]},{"f":59,"ball":[1151.2,917.4,39.0,0.85]},{"f":60,"ball":[1151.6,916.3,39.0,0.92]},{"f":61,"ball":[1149.3,918.6,39.0,0.94]},{"f":62,"ball":[1151.4,913.6,39.0,0.89]},{"f":63,"ball":[1150.0,915.9,39.0,0.89]},{"f":64,"ball":[1149.6,915.6,39.0,0.82]},{"f":65,"ball":[1148.5,915.6,39.0,0.82]},{"f":66,"ball":[1148.7,915.3,39.0,0.97]},{"f":67,"ball":[1151.8,915.5,39.0,0.88]},{"f":68,"ball":[1149.9,914.7,39.0,0.86]},{"f":69,"ball":[1151.5,916.2,39.0,0.86]},{"f":70,"ball":[1150.3,916.7,39.0,0.8]},{"f":71,"ball":[1150.6,918.2,39.0,0.95]},{"f":72,"ball":[1150.3,915.2,39.0,0.94]},{"f":73,"ball":[1148.4,916.6,39.0,0.92]},{"f":74,"ball":[1149.7,915.5,39.0,0.97]},{"f":75,"ball":[1148.6,915.5,39.0,0.87]},{"f":76,"ball":[1150.4,917.0,39.0,0.96]},{"f":77,"ball":[1149.6,914.1,39.0,0.88]},{"f":78,"ball":[1150.3,918.2,39.0,0.93]},{"f":79,"ball":[1149.8,917.3,39.0,0.87]},{"f":80,"ball":[1148.8,914.9,39.0,0.81]},{"f":81,"ball":[1150.0,917.8,39.0,0.85]},{"f":82,"ball":[1150.6,914.3,39.0,0.94]},{"f":83,"ball":[1150.0,916.4,39.0,0.86]},{"f":84,"ball":[1149.6,918.2,39.0,0.95]},{"f":85,"ball":[1150.8,915.4,39.0,0.83]},{"f":86,"ball":[1149.6,918.8,39.0,0.8]},{"f":87,"ball":[1149.3,915.8,39.0,0.8]},{"f":88,"ball":[1151.4,916.9,39.0,0.82]},{"f":89,"ball":[1151.4,918.8,39.0,0.87]},{"f":90,"ball":[1149.3,916.4,39.0,0.81]},{"f":91,"ball":[1148.7,917.6,39.0,0.82]},{"f":92,"ball":[1149.1,915.8,39.0,0.83]},{"f":93,"ball":[1149.1,915.3,39.0,0.8]},{"f":94,"ball":[1151.7,914.7,39.0,0.97]},{"f":95,"ball":[1151.2,917.1,39.0,0.81]},{"f":96,"ball":[1150.6,916.0,39.0,0.82]},{"f":97,"ball":[1150.2,916.8,39.0,0.8]},{"f":98,"ball":[1149.8,914.0,39.0,0.81]},{"f":99,"ball":[1152.3,915.9,39.0,0.91]},{"f":100,"ball":[1149.2,916.7,39.0,0.87]},{"f":101,"ball":[1151.0,914.4,39.0,0.8]},{"f":102,"ball":[1150.7,916.6,39.0,0.94]},{"f":103,"ball":[1147.5,915.8,39.0,0.87]},{"f":104,"ball":[1206.1,901.3,39.0,0.92]},{"f":105,"ball":[1266.5,887.4,39.0,0.82]},{"f":106,"ball":[1321.9,870.0,39.0,0.92]},{"f":107,"ball":[1381.4,858.3,39.0,0.95]},{"f":108,"ball":[1441.6,846.1,39.0,0.97]},{"f":109,"ball":[1499.3,830.3,39.0,0.84]},{"f":110,"ball":[1558.1,817.9,39.0,0.88]},{"f":111,"ball":[1615.5,806.9,39.0,0.82]},{"f":112,"ball":[1674.3,796.0,39.0,0.9]},{"f":113,"ball":[1734.2,782.7,39.0,0.85]},{"f":114,"ball":[1790.1,769.3,39.0,0.96]},{"f":115,"ball":[1849.0,758.8,39.0,0.91]},{"f":116,"ball":[1905.5,748.0,39.0,0.97]},{"f":117,"ball":null},{"f":118,"ball":null},{"f":119,"ball":null},{"f":120,"ball":null},{"f":121,"ball":null},{"f":122,"ball":null},{"f":123,"ball":null},{"f":124,"ball":null},{"f":125,"ball":null},{"f":126,"ball":null},{"f":127,"ball":null},{"f":128,"ball":null},{"f":129,"ball":null},{"f":130,"ball":null},{"f":131,"ball":null},{"f":132,"ball":null},{"f":133,"ball":null},{"f":134,"ball":null},{"f":135,"ball":null},{"f":136,"ball":null},{"f":137,"ball":null},{"f":138,"ball":null},{"f":139,"ball":null},{"f":140,"ball":null},{"f":141,"ball":null},{"f":142,"ball":null},{"f":143,"ball":null},{"f":144,"ball":null},{"f":145,"ball":null},{"f":146,"ball":null},{"f":147,"ball":null},{"f":148,"ball":null},{"f":149,"ball":null},{"f":150,"ball":null},{"f":151,"ball":null},{"f":152,"ball":null},{"f":153,"ball":null},{"f":154,"ball":null},{"f":155,"ball":null},{"f":156,"ball":null},{"f":157,"ball":null},{"f":158,"ball":null},{"f":159,"ball":null},{"f":160,"ball":null},{"f":161,"ball":null},{"f":162,"ball":null},{"f":163,"ball":null},{"f":164,"ball":null},{"f":165,"ball":null},{"f":166,"ball":null},{"f":167,"ball":null},{"f":168,"ball":null},{"f":169,"ball":null},{"f":170,"ball":null},{"f":171,"ball":null},{"f":172,"ball":null},{"f":173,"ball":null},{"f":174,"ball":null},{"f":175,"ball":null},{"f":176,"ball":null},{"f":177,"ball":null},{"f":178,"ball":null},{"f":179,"ball":null},{"f":180,"ball":null},{"f":181,"ball":null},{"f":182,"ball":null},{"f":183,"ball":null},{"f":184,"ball":null},{"f":185,"ball":null},{"f":186,"ball":null},{"f":187,"ball":null},{"f":188,"ball":null},{"f":189,"ball":null},{"f":190,"ball":null},{"f":191,"ball":null},{"f":192,"ball":null},{"f":193,"ball":null},{"f":194,"ball":null},{"f":195,"ball":null},{"f":196,"ball":null},{"f":197,"ball":null},{"f":198,"ball":null},{"f":199,"ball":null},{"f":200,"ball":null},{"f":201,"ball":null},{"f":202,"ball":null},{"f":203,"ball":null},{"f":204,"ball":null},{"f":205,"ball":null},{"f":206,"ball":null},{"f":207,"ball":null},{"f":208,"ball":null},{"f":209,"ball":null},{"f":210,"ball":null},{"f":211,"ball":null},{"f":212,"ball":null},{"f":213,"ball":null},{"f":214,"ball":null},{"f":215,"ball":null},{"f":216,"ball":null},{"f":217,"ball":null},{"f":218,"ball":null},{"f":219,"ball":null},{"f":220,"ball":null},{"f":221,"ball":null},{"f":222,"ball":null},{"f":223,"ball":null},{"f":224,"ball":null},{"f":225,"ball":null},{"f":226,"ball":null},{"f":227,"ball":null},{"f":228,"ball":[1151.3,917.1,39.0,0.97]},{"f":229,"ball":[1149.3,917.1,39.0,0.97]},{"f":230,"ball":[1150.8,915.3,39.0,0.85]},{"f":231,"ball":[1148.2,915.9,39.0,0.9]},{"f":232,"ball":[1148.5,916.7,39.0,0.88]},{"f":233,"ball":[1148.7,917.7,39.0,0.88]},{"f":234,"ball":[1150.4,916.1,39.0,0.86]},{"f":235,"ball":[1150.5,916.2,39.0,0.87]},{"f":236,"ball":[1151.9,917.5,39.0,0.93]},{"f":237,"ball":[1148.8,917.3,39.0,0.92]},{"f":238,"ball":[1149.8,915.8,39.0,0.82]},{"f":239,"ball":[1149.8,915.6,39.0,0.9]},{"f":240,"ball":[1148.2,916.3,39.0,0.9]},{"f":241,"ball":[1150.9,917.0,39.0,0.82]},{"f":242,"ball":[1148.2,915.4,39.0,0.82]},{"f":243,"ball":[1149.9,917.2,39.0,0.81]},{"f":244,"ball":[1149.3,917.3,39.0,0.93]},{"f":245,"ball":[1151.0,915.2,39.0,0.88]},{"f":246,"ball":[1150.0,913.2,39.0,0.94]},{"f":247,"ball":[1151.2,914.4,39.0,0.87]},{"f":248,"ball":[1150.7,916.1,39.0,0.97]},{"f":249,"ball":[1149.2,915.3,39.0,0.93]},{"f":250,"ball":[1150.0,916.7,39.0,0.96]},{"f":251,"ball":[1150.3,917.3,39.0,0.91]},{"f":252,"ball":[1152.1,915.4,39.0,0.8]},{"f":253,"ball":[1149.4,916.9,39.0,0.93]},{"f":254,"ball":[1150.7,912.7,39.0,0.82]},{"f":255,"ball":[1150.6,917.8,39.0,0.86]},{"f":256,"ball":[1149.7,915.2,39.0,0.84]},{"f":257,"ball":[1150.2,917.2,39.0,0.81]},{"f":258,"ball":[1151.4,915.2,39.0,0.95]},{"f":259,"ball":[1151.4,914.5,39.0,0.94]},{"f":260,"ball":[1150.9,916.4,39.0,0.96]},{"f":261,"ball":[1150.1,916.6,39.0,0.95]},{"f":262,"ball":[1151.8,915.8,39.0,0.86]},{"f":263,"ball":[1150.3,917.6,39.0,0.97]},{"f":264,"ball":[1149.7,916.4,39.0,0.84]},{"f":265,"ball":[1150.2,914.7,39.0,0.83]},{"f":266,"ball":[1150.8,915.0,39.0,0.9]},{"f":267,"ball":[1148.9,913.7,39.0,0.89]},{"f":268,"ball":[1152.1,915.3,39.0,0.89]},{"f":269,"ball":[1151.3,916.1,39.0,0.96]},{"f":270,"ball":[1152.4,918.9,39.0,0.93]},{"f":271,"ball":[1149.7,916.9,39.0,0.91]},{"f":272,"ball":[1148.6,915.0,39.0,0.86]},{"f":273,"ball":[1150.3,916.9,39.0,0.95]},{"f":274,"ball":[1149.3,917.8,39.0,0.95]},{"f":275,"ball":[1150.5,915.9,39.0,0.8]},{"f":276,"ball":[1149.3,913.8,39.0,0.94]},{"f":277,"ball":[1148.0,914.1,39.0,0.82]},{"f":278,"ball":[1151.6,916.8,39.0,0.97]},{"f":279,"ball":[1149.4,916.0,39.0,0.81]},{"f":280,"ball":[1148.9,915.6,39.0,0.9]},{"f":281,"ball":[1152.1,916.2,39.0,0.83]},{"f":282,"ball":[1148.1,916.4,39.0,0.81]},{"f":283,"ball":[1150.7,917.1,39.0,0.93]},{"f":284,"ball":[1148.5,915.5,39.0,0.87]},{"f":285,"ball":[1148.8,915.8,39.0,0.94]},{"f":286,"ball":[1151.6,914.1,39.0,0.86]},{"f":287,"ball":[1150.5,915.6,39.0,0.86]},{"f":288,"ball":[1151.4,915.8,39.0,0.81]},{"f":289,"ball":[1152.7,915.0,39.0,0.93]},{"f":290,"ball":[1151.2,916.7,39.0,0.94]},{"f":291,"ball":[1150.7,915.1